triflow/utils/tri_kernel/TriAttentionCache/0/_attention_fwd_8-0.json
{
    "4_32_3040_torch.float32_torch.float32_torch.float32_torch.float32_torch.float32_torch.float32_torch.float32": {
        "kwargs": {
            "BLOCK_M": 64,
            "BLOCK_N": 16
        },
        "num_warps": 2,
        "num_stages": 3
    },
    "4_32_1152_torch.float32_torch.float32_torch.float32_torch.float32_torch.float32_torch.float32_torch.float32": {
        "kwargs": {
            "BLOCK_M": 64,
            "BLOCK_N": 16
        },
        "num_warps": 2,
        "num_stages": 3
    },
    "4_32_384_torch.float32_torch.float32_torch.float32_torch.float32_torch.float32_torch.float32_torch.float32": {
        "kwargs": {
            "BLOCK_M": 64,
            "BLOCK_N": 16
        },
        "num_warps": 2,
        "num_stages": 3
    },
    "4_32_96_torch.float32_torch.float32_torch.float32_torch.float32_torch.float32_torch.float32_torch.float32": {
        "kwargs": {
            "BLOCK_M": 64,
            "BLOCK_N": 16
        },
        "num_warps": 2,
        "num_stages": 3
    },
    "4_32_512_torch.float32_torch.float32_torch.float32_torch.float32_torch.float32_torch.float32_torch.float32": {
        "kwargs": {
            "BLOCK_M": 64,
            "BLOCK_N": 16
        },
        "num_warps": 2,
        "num_stages": 3
    },
    "4_32_736_torch.float32_torch.float32_torch.float32_torch.float32_torch.float32_torch.float32_torch.float32": {
        "kwargs": {
            "BLOCK_M": 32,
            "BLOCK_N": 16
        },
        "num_warps": 1,
        "num_stages": 2
    },
    "4_32_576_torch.float32_torch.float32_torch.float32_torch.float32_torch.float32_torch.float32_torch.float32": {
        "kwargs": {
            "BLOCK_M": 64,
            "BLOCK_N": 16
        },
        "num_warps": 2,
        "num_stages": 3
    },
    "4_32_448_torch.float32_torch.float32_torch.float32_torch.float32_torch.float32_torch.float32_torch.float32": {
        "kwargs": {
            "BLOCK_M": 64,
            "BLOCK_N": 16
        },
        "num_warps": 2,
        "num_stages": 3
    },
    "4_32_256_torch.float32_torch.float32_torch.float32_torch.float32_torch.float32_torch.float32_torch.float32": {
        "kwargs": {
            "BLOCK_M": 64,
            "BLOCK_N": 16
        },
        "num_warps": 2,
        "num_stages": 3
    },
    "4_32_128_torch.float32_torch.float32_torch.float32_torch.float32_torch.float32_torch.float32_torch.float32": {
        "kwargs": {
            "BLOCK_M": 64,
            "BLOCK_N": 32
        },
        "num_warps": 4,
        "num_stages": 2
    },
    "4_32_288_torch.float32_torch.float32_torch.float32_torch.float32_torch.float32_torch.float32_torch.float32": {
        "kwargs": {
            "BLOCK_M": 32,
            "BLOCK_N": 16
        },
        "num_warps": 1,
        "num_stages": 2
    },
    "4_32_608_torch.float32_torch.float32_torch.float32_torch.float32_torch.float32_torch.float32_torch.float32": {
        "kwargs": {
            "BLOCK_M": 32,
            "BLOCK_N": 16
        },
        "num_warps": 1,
        "num_stages": 2
    },
    "4_32_704_torch.float32_torch.float32_torch.float32_torch.float32_torch.float32_torch.float32_torch.float32": {
        "kwargs": {
            "BLOCK_M": 16,
            "BLOCK_N": 32
        },
        "num_warps": 1,
        "num_stages": 2
    },
    "4_32_1024_torch.float32_torch.float32_torch.float32_torch.float32_torch.float32_torch.float32_torch.float32": {
        "kwargs": {
            "BLOCK_M": 64,
            "BLOCK_N": 16
        },
        "num_warps": 2,
        "num_stages": 3
    },
    "4_32_192_torch.float32_torch.float32_torch.float32_torch.float32_torch.float32_torch.float32_torch.float32": {
        "kwargs": {
            "BLOCK_M": 64,
            "BLOCK_N": 16
        },
        "num_warps": 2,
        "num_stages": 3
    }
}