triflow/utils/tri_kernel/TriAttentionCache/0/_attention_fwd_9-0.json
{
    "4_32_96_torch.float32_torch.float32_torch.float32_torch.float32_torch.float32_torch.float32_torch.float32": {
        "kwargs": {
            "BLOCK_M": 16,
            "BLOCK_N": 32
        },
        "num_warps": 1,
        "num_stages": 2
    },
    "4_32_512_torch.float32_torch.float32_torch.float32_torch.float32_torch.float32_torch.float32_torch.float32": {
        "kwargs": {
            "BLOCK_M": 64,
            "BLOCK_N": 16
        },
        "num_warps": 2,
        "num_stages": 3
    },
    "4_32_736_torch.float32_torch.float32_torch.float32_torch.float32_torch.float32_torch.float32_torch.float32": {
        "kwargs": {
            "BLOCK_M": 64,
            "BLOCK_N": 32
        },
        "num_warps": 4,
        "num_stages": 2
    },
    "4_32_576_torch.float32_torch.float32_torch.float32_torch.float32_torch.float32_torch.float32_torch.float32": {
        "kwargs": {
            "BLOCK_M": 32,
            "BLOCK_N": 64
        },
        "num_warps": 2,
        "num_stages": 2
    },
    "4_32_448_torch.float32_torch.float32_torch.float32_torch.float32_torch.float32_torch.float32_torch.float32": {
        "kwargs": {
            "BLOCK_M": 64,
            "BLOCK_N": 16
        },
        "num_warps": 2,
        "num_stages": 3
    },
    "4_32_256_torch.float32_torch.float32_torch.float32_torch.float32_torch.float32_torch.float32_torch.float32": {
        "kwargs": {
            "BLOCK_M": 64,
            "BLOCK_N": 16
        },
        "num_warps": 2,
        "num_stages": 3
    },
    "4_32_128_torch.float32_torch.float32_torch.float32_torch.float32_torch.float32_torch.float32_torch.float32": {
        "kwargs": {
            "BLOCK_M": 64,
            "BLOCK_N": 16
        },
        "num_warps": 2,
        "num_stages": 3
    },
    "4_32_288_torch.float32_torch.float32_torch.float32_torch.float32_torch.float32_torch.float32_torch.float32": {
        "kwargs": {
            "BLOCK_M": 64,
            "BLOCK_N": 32
        },
        "num_warps": 4,
        "num_stages": 2
    },
    "4_32_608_torch.float32_torch.float32_torch.float32_torch.float32_torch.float32_torch.float32_torch.float32": {
        "kwargs": {
            "BLOCK_M": 64,
            "BLOCK_N": 32
        },
        "num_warps": 4,
        "num_stages": 2
    },
    "4_32_384_torch.float32_torch.float32_torch.float32_torch.float32_torch.float32_torch.float32_torch.float32": {
        "kwargs": {
            "BLOCK_M": 64,
            "BLOCK_N": 32
        },
        "num_warps": 4,
        "num_stages": 2
    },
    "4_32_352_torch.float32_torch.float32_torch.float32_torch.float32_torch.float32_torch.float32_torch.float32": {
        "kwargs": {
            "BLOCK_M": 64,
            "BLOCK_N": 32
        },
        "num_warps": 4,
        "num_stages": 2
    },
    "4_32_320_torch.float32_torch.float32_torch.float32_torch.float32_torch.float32_torch.float32_torch.float32": {
        "kwargs": {
            "BLOCK_M": 64,
            "BLOCK_N": 16
        },
        "num_warps": 2,
        "num_stages": 3
    },
    "4_32_544_torch.float32_torch.float32_torch.float32_torch.float32_torch.float32_torch.float32_torch.float32": {
        "kwargs": {
            "BLOCK_M": 32,
            "BLOCK_N": 64
        },
        "num_warps": 2,
        "num_stages": 2
    },
    "4_32_224_torch.float32_torch.float32_torch.float32_torch.float32_torch.float32_torch.float32_torch.float32": {
        "kwargs": {
            "BLOCK_M": 64,
            "BLOCK_N": 16
        },
        "num_warps": 2,
        "num_stages": 3
    },
    "4_32_160_torch.float32_torch.float32_torch.float32_torch.float32_torch.float32_torch.float32_torch.float32": {
        "kwargs": {
            "BLOCK_M": 64,
            "BLOCK_N": 32
        },
        "num_warps": 4,
        "num_stages": 2
    },
    "4_32_864_torch.float32_torch.float32_torch.float32_torch.float32_torch.float32_torch.float32_torch.float32": {
        "kwargs": {
            "BLOCK_M": 64,
            "BLOCK_N": 32
        },
        "num_warps": 4,
        "num_stages": 2
    },
    "4_32_672_torch.float32_torch.float32_torch.float32_torch.float32_torch.float32_torch.float32_torch.float32": {
        "kwargs": {
            "BLOCK_M": 32,
            "BLOCK_N": 64
        },
        "num_warps": 2,
        "num_stages": 2
    },
    "4_32_192_torch.float32_torch.float32_torch.float32_torch.float32_torch.float32_torch.float32_torch.float32": {
        "kwargs": {
            "BLOCK_M": 64,
            "BLOCK_N": 16
        },
        "num_warps": 2,
        "num_stages": 3
    },
    "4_32_480_torch.float32_torch.float32_torch.float32_torch.float32_torch.float32_torch.float32_torch.float32": {
        "kwargs": {
            "BLOCK_M": 64,
            "BLOCK_N": 32
        },
        "num_warps": 4,
        "num_stages": 2
    },
    "4_32_416_torch.float32_torch.float32_torch.float32_torch.float32_torch.float32_torch.float32_torch.float32": {
        "kwargs": {
            "BLOCK_M": 64,
            "BLOCK_N": 16
        },
        "num_warps": 2,
        "num_stages": 3
    },
    "4_32_768_torch.float32_torch.float32_torch.float32_torch.float32_torch.float32_torch.float32_torch.float32": {
        "kwargs": {
            "BLOCK_M": 64,
            "BLOCK_N": 16
        },
        "num_warps": 2,
        "num_stages": 3
    },
    "4_32_928_torch.float32_torch.float32_torch.float32_torch.float32_torch.float32_torch.float32_torch.float32": {
        "kwargs": {
            "BLOCK_M": 32,
            "BLOCK_N": 64
        },
        "num_warps": 2,
        "num_stages": 2
    },
    "4_32_704_torch.float32_torch.float32_torch.float32_torch.float32_torch.float32_torch.float32_torch.float32": {
        "kwargs": {
            "BLOCK_M": 64,
            "BLOCK_N": 16
        },
        "num_warps": 2,
        "num_stages": 3
    },
    "4_32_896_torch.float32_torch.float32_torch.float32_torch.float32_torch.float32_torch.float32_torch.float32": {
        "kwargs": {
            "BLOCK_M": 64,
            "BLOCK_N": 32
        },
        "num_warps": 4,
        "num_stages": 2
    },
    "4_32_832_torch.float32_torch.float32_torch.float32_torch.float32_torch.float32_torch.float32_torch.float32": {
        "kwargs": {
            "BLOCK_M": 32,
            "BLOCK_N": 64
        },
        "num_warps": 2,
        "num_stages": 2
    },
    "4_32_64_torch.float32_torch.float32_torch.float32_torch.float32_torch.float32_torch.float32_torch.float32": {
        "kwargs": {
            "BLOCK_M": 32,
            "BLOCK_N": 64
        },
        "num_warps": 2,
        "num_stages": 2
    },
    "4_32_640_torch.float32_torch.float32_torch.float32_torch.float32_torch.float32_torch.float32_torch.float32": {
        "kwargs": {
            "BLOCK_M": 32,
            "BLOCK_N": 64
        },
        "num_warps": 2,
        "num_stages": 2
    },
    "4_32_960_torch.float32_torch.float32_torch.float32_torch.float32_torch.float32_torch.float32_torch.float32": {
        "kwargs": {
            "BLOCK_M": 32,
            "BLOCK_N": 64
        },
        "num_warps": 2,
        "num_stages": 2
    },
    "4_32_992_torch.float32_torch.float32_torch.float32_torch.float32_torch.float32_torch.float32_torch.float32": {
        "kwargs": {
            "BLOCK_M": 32,
            "BLOCK_N": 64
        },
        "num_warps": 2,
        "num_stages": 2
    },
    "4_32_800_torch.float32_torch.float32_torch.float32_torch.float32_torch.float32_torch.float32_torch.float32": {
        "kwargs": {
            "BLOCK_M": 32,
            "BLOCK_N": 64
        },
        "num_warps": 2,
        "num_stages": 2
    },
    "4_32_1024_torch.float32_torch.float32_torch.float32_torch.float32_torch.float32_torch.float32_torch.float32": {
        "kwargs": {
            "BLOCK_M": 32,
            "BLOCK_N": 64
        },
        "num_warps": 2,
        "num_stages": 2
    },
    "4_32_544_torch.bfloat16_torch.bfloat16_torch.bfloat16_torch.bfloat16_torch.bfloat16_torch.bfloat16_torch.float32": {
        "kwargs": {
            "BLOCK_M": 64,
            "BLOCK_N": 32
        },
        "num_warps": 4,
        "num_stages": 2
    },
    "4_32_2784_torch.float32_torch.float32_torch.float32_torch.float32_torch.float32_torch.float32_torch.float32": {
        "kwargs": {
            "BLOCK_M": 64,
            "BLOCK_N": 16
        },
        "num_warps": 2,
        "num_stages": 3
    },
    "4_32_3040_torch.float32_torch.float32_torch.float32_torch.float32_torch.float32_torch.float32_torch.float32": {
        "kwargs": {
            "BLOCK_M": 64,
            "BLOCK_N": 32
        },
        "num_warps": 4,
        "num_stages": 2
    }
}